numerical_id,idiom,idiom_literal_translation,idiomatic_meaning,idiomatic_meaning_translation,familiarity,sd_familiarity,n_familiarity,knowledge,sd_knowledge,n_knowledge,knowledge_%,decomposability,n_decomposability,literality,sd_literality,n_literality,predictability_%,n_predictability,valence,sd_valence,n_valence,arousal,sd_arousal,n_arousal,length_in_letters,length_in_words
924,Sacar las garras,To pull one's claws out,Mostrarse agresivo,Being aggressive,5.166666666666667,1.949,30,6.142857142857143,1.062,21,85.71428571428571,0.8260869565217391,23,4.571428571428571,2.087,21,10.81081081081081,19,2.6785714285714284,1.611,28,5.310344827586207,1.583,29,14,3
925,Sacar las uñas,Take out one's fingernails,Mostrarse agresivo,Being aggressive,5.619047619047619,1.024,21,6.3,0.923,20,80.0,0.75,28,4.782608695652174,1.93,23,13.513513513513514,19,2.85,1.387,20,5.0,1.718,22,12,3
926,Sacar los colores,Take out the colors,Sonrojar,Blushing,5.190476190476191,2.015,21,5.8,2.093,20,80.0,0.6666666666666666,24,5.173913043478261,1.749,23,13.157894736842104,19,3.238095238095238,1.48,21,4.523809523809524,1.662,21,15,3
927,Sacar los dientes,Take out the teeth,Enfadarse,Getting angry,4.476190476190476,1.662,21,5.4,1.903,20,60.0,0.5652173913043478,23,5.695652173913044,1.769,23,13.157894736842104,19,2.6,1.314,20,5.25,1.251,20,15,3
928,Sacar partido,To take advantage,Obtener un provecho,Making a profit,5.333333333333333,1.461,21,6.388888888888889,0.916,18,100.0,0.43478260869565216,23,3.3,1.976,20,2.4096385542168677,21,5.653846153846154,1.018,26,4.571428571428571,1.938,21,12,2
929,Sacar pecho,Take out the chest,Actitud de orgullo,Prideful attitude,4.928571428571429,1.676,28,5.894736842105263,1.197,19,94.73684210526315,0.5652173913043478,23,5.052631578947368,2.147,19,1.2048192771084338,21,5.055555555555555,1.514,18,4.875,1.262,24,10,2
930,Sacar punta,Sharpen,Atribuir un significado que no tiene,Attributing a meaning it does not have,3.9166666666666665,2.125,24,4.105263157894737,2.233,19,31.57894736842105,0.041666666666666664,24,6.3,1.302,20,8.433734939759036,21,4.277777777777778,1.526,18,4.0,1.195,15,10,2
931,Sacar tajada,To get out a slice,"Aprovecharse, sacar ventaja de algo",To take advantage of something,3.8,1.958,25,6.238095238095238,1.609,21,95.23809523809523,0.3181818181818182,22,3.111111111111111,1.844,18,0.0,21,4.823529411764706,1.741,17,4.421052631578948,1.387,19,11,2
932,Sacarle el jugo a alguien,To take the juice out of someone,Aprovechar al máximo algo de una persona,To take full advantage of something from a person,3.4545454545454546,2.283,22,3.3181818181818183,2.514,22,45.45454545454545,0.7727272727272727,22,2.6666666666666665,1.645,18,10.0,20,3.95,1.605,20,4.391304347826087,1.699,23,21,5
933,Sacarse la venda de los ojos,To take the blindfold off,Ver algo que era incapaz de ver,To see something that one was unable to see,5.375,1.861,24,6.421052631578948,0.961,19,100.0,0.9,30,6.636363636363637,0.658,22,95.65217391304348,23,5.678571428571429,1.219,28,4.25,1.86,20,23,6
934,Salir a flote,To come out floating,Salir de una dificultad o apuro,To get out of a difficulty or predicament,3.9642857142857144,1.835,28,5.578947368421052,1.981,19,78.94736842105263,0.6521739130434783,23,4.888888888888889,2.083,18,0.0,20,5.888888888888889,1.132,18,4.88,1.481,25,11,3
935,Salir a la palestra,To come out to the fore,Darse a conocer o hacer pública aparición,To make oneself known or make a public appearance,3.7037037037037037,1.66,27,3.0476190476190474,2.418,21,38.095238095238095,0.5769230769230769,26,5.52,1.61,25,0.0,20,3.533333333333333,1.302,15,4.066666666666666,1.751,15,16,4
936,Salir a pedir de boca,To go out as I asked by my mouth,"Muy bien, como se deseaba","Very well, as desired",4.296296296296297,1.728,27,5.285714285714286,2.452,21,76.19047619047619,0.2857142857142857,21,2.4074074074074074,1.474,27,52.63157894736842,19,6.105263157894737,1.524,19,3.8333333333333335,2.256,18,17,5
937,Salir con los pies por delante,Going out feet first,Morir,To die,4.193548387096774,2.136,31,4.761904761904762,2.189,21,14.285714285714285,0.36,25,5.090909090909091,2.068,22,38.88888888888889,18,3.4,2.197,15,4.238095238095238,2.119,21,25,6
938,Salir de marcha,Going out marching,Salir a divertirse,To go out and have fun,6.045454545454546,1.812,22,6.636363636363637,1.293,22,90.9090909090909,0.7272727272727273,22,4.722222222222222,1.965,18,45.0,20,5.68,1.6,25,6.148148148148148,1.167,27,13,3
939,Salir del armario,Coming out of the closet,Declarar públicamente la homosexualidad,To publicly declare homosexuality,6.12,1.201,25,6.428571428571429,1.363,21,95.23809523809523,0.16666666666666666,30,4.291666666666667,2.678,24,56.09756097560976,21,5.590909090909091,1.333,22,4.863636363636363,1.457,22,15,3
940,Salir del fuego para caer en las brasas,Going out of the fire to fall into the embers,Intentando solucionar un problema se da con otro mayor,Attempting to solve one problem leads to a bigger one,2.8214285714285716,2.038,28,4.421052631578948,2.293,19,73.68421052631578,0.46153846153846156,26,3.8333333333333335,2.407,18,34.78260869565217,23,1.8333333333333333,0.786,18,3.2,2.062,25,32,8
941,Salir del nido,Exit the nest,Independizarse,Become independent,3.6785714285714284,2.195,28,5.894736842105263,1.663,19,94.73684210526315,0.9583333333333334,24,5.111111111111111,1.676,18,0.0,21,5.5625,0.892,16,4.695652173913044,1.608,23,12,3
942,Salir el tiro por la culata,Backfire,Obtener resultado contrario al pretendido,Obtaining the opposite of the intended result,5.518518518518518,1.341,27,6.666666666666667,0.658,21,100.0,0.5,22,3.888888888888889,2.118,27,90.0,20,2.4545454545454546,1.625,22,3.15,1.565,20,22,6
943,Salir pitando,To get out beeping the horn,Salir con gran rapidez,Going out very quickly,5.8,1.472,25,6.523809523809524,1.327,21,95.23809523809523,0.4,25,4.833333333333333,2.18,24,10.526315789473683,19,3.727272727272727,1.241,22,4.7727272727272725,1.412,22,12,2
944,Salir por la puerta de atrás,Leaving by the back door,Escapar sin ser visto (sin haber logrado un objetivo),Running away without being seen (without having achieved a goal),5.2727272727272725,1.638,22,4.7727272727272725,2.369,22,45.45454545454545,0.9565217391304348,23,5.470588235294118,1.908,17,75.0,20,2.739130434782609,1.287,23,2.3043478260869565,1.636,23,23,6
945,Salir por patas,Exit by legs,Irse de un sitio corriendo,Running away from a place,5.903225806451613,1.399,31,6.380952380952381,0.74,21,100.0,0.391304347826087,23,3.8181818181818183,2.062,22,42.10526315789473,19,3.4285714285714284,1.469,21,4.7727272727272725,1.744,22,13,3
946,Salirse de madre,Going out from mother,Pasar los límites razonables o normales,Going beyond reasonable or normal limits,4.3,1.809,20,4.75,2.403,20,60.0,0.17391304347826086,23,2.391304347826087,1.406,23,30.0,20,3.5294117647058822,1.505,17,5.043478260869565,1.609,23,14,3
947,Salirse por la tangente,Going off on a tangent,Evasiva para salir de un apuro,Evasive to get out of trouble,3.380952380952381,2.061,21,3.9444444444444446,2.071,18,66.66666666666666,0.08695652173913043,23,2.388888888888889,1.72,18,5.0,20,2.923076923076923,1.383,26,3.4210526315789473,1.895,19,20,4
948,Saltar al vacío,Jumping into the void,Arriesgarse,Taking a risk,4.2592592592592595,1.873,27,4.904761904761905,1.841,21,76.19047619047619,0.42857142857142855,21,5.7407407407407405,1.701,27,65.21739130434783,23,2.772727272727273,1.193,22,4.157894736842105,1.951,19,13,3
949,Saltar todas las alarmas,The alarms have been triggered,Advertencia de la proximidad de un peligro,Warning of approaching danger,4.466666666666667,2.03,30,5.0476190476190474,2.012,21,66.66666666666666,0.9,30,4.75,2.359,20,33.33333333333333,18,2.4444444444444446,1.086,27,5.103448275862069,1.839,29,21,4
950,Saltarse algo a la torera,To skip something as a bullfighter,Omitir audazmente el cumplir una norma,Boldly omitting to comply with a rule,3.5833333333333335,2.104,24,4.157894736842105,2.478,19,57.89473684210527,0.2,30,2.25,1.713,20,11.76470588235294,17,2.1739130434782608,1.029,23,3.35,1.599,20,21,5
951,Salvar el pellejo,Saving your own skin,Salir con vida de un peligro,Getting out of danger alive,5.709677419354839,1.697,31,6.190476190476191,1.47,21,95.23809523809523,0.6521739130434783,23,3.6818181818181817,1.783,22,13.043478260869565,23,5.8,1.24,20,5.045454545454546,1.397,22,15,3
952,Se le ve el plumero,You can see the feather duster,Descubrir las intenciones,Discovering intentions,5.5,1.606,20,6.2,0.951,20,100.0,0.21739130434782608,23,4.086956521739131,1.857,23,95.0,20,2.3333333333333335,0.767,18,3.6,1.555,25,15,5
953,Seguir al rebaño,Follow the herd,Imitar a la mayoría,Imitating the majority,4.523809523809524,1.94,21,6.666666666666667,0.617,15,100.0,0.9565217391304348,23,6.523809523809524,1.167,21,5.263157894736842,19,3.1153846153846154,1.177,26,3.25,1.97,20,14,3
954,Seguir en sus trece,Remaining in their own thirteen,"Mantener una opinión, actitud o propósito con obstinación","Stubbornly holding to an opinion, attitude or purpose",4.966666666666667,1.771,30,6.0476190476190474,1.717,21,80.95238095238095,0.07142857142857142,28,1.9444444444444444,1.731,18,72.22222222222221,18,2.5555555555555554,1.311,27,3.607142857142857,1.792,28,16,4
955,Seguir la corriente,Going with the flow,Seguir la opinión general,To follow the general opinion,5.928571428571429,1.052,28,6.368421052631579,0.955,19,100.0,0.8461538461538461,26,5.473684210526316,1.645,19,52.17391304347826,23,3.9473684210526314,1.026,19,2.8461538461538463,1.223,26,17,3
956,Sembrar cizaña,Sowing tares,Motivar recelo o discordia,Motivate suspicion or discord,2.7142857142857144,1.978,21,5.25,2.049,20,80.0,0.24,25,2.2857142857142856,1.736,21,0.0,22,1.6666666666666667,0.84,18,4.277777777777778,1.602,18,13,2
957,Sembrar discordia,Sowing discord,Incitar la falta de entendimiento,Incite lack of understanding,2.761904761904762,1.67,21,4.333333333333333,2.556,20,47.61904761904761,0.6538461538461539,26,1.9545454545454546,1.676,22,2.3255813953488373,22,2.588235294117647,1.064,18,3.16,1.772,25,16,2
958,Sembrar la duda,Sowing doubt,Poner en duda,To cast doubt,4.333333333333333,1.494,27,5.0,1.817,21,85.71428571428571,0.8260869565217391,23,2.4615384615384617,2.044,26,19.047619047619047,21,3.238095238095238,1.338,21,3.6842105263157894,1.887,19,13,3
959,Sentar a alguien en el banquillo,Seat someone on the bench,Juzgar,To judge,3.909090909090909,2.408,22,3.8181818181818183,2.737,22,4.545454545454546,0.3333333333333333,21,5.333333333333333,1.495,18,15.789473684210526,19,2.5,0.964,22,2.56,1.583,25,27,6
960,Sentar la cabeza,Sit down the head,Volverse maduro y juicioso,Become mature and judicious,5.809523809523809,1.504,21,6.111111111111111,1.079,18,94.44444444444444,0.43333333333333335,30,2.95,2.064,20,85.0,20,5.884615384615385,0.952,26,3.8095238095238093,2.04,21,14,3
961,Sentar las bases,Laying the foundations,Establecer condiciones (en un inicio),Set conditions (initially),3.7,1.915,30,4.523809523809524,2.136,21,71.42857142857143,0.5833333333333334,24,3.263157894736842,2.281,19,26.31578947368421,19,5.5,0.962,28,3.1923076923076925,1.497,26,14,3
962,Sentirse como pez en el agua,Feeling like a fish in water,Con comodidad o soltura,With comfort or ease,5.516129032258065,1.73,31,6.380952380952381,1.203,21,95.23809523809523,0.9130434782608695,23,4.0,1.799,22,90.47619047619048,21,6.523809523809524,1.167,21,4.545454545454546,2.132,22,23,6
963,Separar el grano de la paja,Separating the wheat from the chaff,Distinguir lo bueno de lo malo,Distinguish right from wrong,2.5714285714285716,1.777,21,3.35,2.455,20,35.0,0.5,24,4.333333333333333,1.826,21,42.10526315789473,19,4.666666666666667,1.496,15,2.8333333333333335,1.528,12,22,6
964,Ser abogado del diablo,Being the devil's advocate,Defender argumento contrario al correcto o esperado,Defend argument contrary to the correct or expected,3.5238095238095237,2.159,21,4.904761904761905,2.322,20,42.857142857142854,0.6,30,3.090909090909091,2.308,22,55.55555555555556,18,1.8571428571428572,0.854,22,3.8,1.732,25,19,4
965,Ser agua pasada,Being water under the bridge,Algo que no volverá,Something that will not return,5.75,1.422,24,5.894736842105263,1.487,19,94.73684210526315,0.6086956521739131,23,2.227272727272727,1.602,22,27.77777777777778,18,3.3214285714285716,1.389,28,2.35,1.348,20,13,3
966,Ser animal de costumbres,To be an animal of habit,Tendemos a la rutina,We tend to routine,3.7096774193548385,2.224,31,5.428571428571429,2.111,21,85.71428571428571,0.8571428571428571,21,3.6818181818181817,1.912,22,15.0,20,3.75,1.02,20,3.1904761904761907,1.632,21,21,4
967,Ser calcado a alguien,To be like someone else,Parecerse mucho a alguien,To be very similar to someone,5.0476190476190474,2.012,21,6.722222222222222,0.575,18,100.0,0.9333333333333333,30,3.85,2.434,20,30.0,20,4.269230769230769,0.919,26,3.2,1.735,20,18,4
968,Ser canela fina,To be fine cinnamon,Cosa exquisita,Exquisite thing,2.6666666666666665,1.932,21,4.888888888888889,2.111,18,83.33333333333334,0.20833333333333334,24,2.823529411764706,1.976,17,9.523809523809524,21,4.6521739130434785,1.722,23,3.823529411764706,1.879,17,13,3
969,Ser carne de cañón,To be cannon fodder,Persona expuesta a sufrir daño,Person exposed to harm,5.037037037037037,1.786,27,4.333333333333333,2.244,21,42.857142857142854,0.26666666666666666,30,2.5185185185185186,1.868,27,33.33333333333333,18,2.7,1.302,20,4.2105263157894735,1.686,19,15,4
970,Ser como dos gotas de agua,To be like two drops of water,Ser muy parecidos/as,Being very similar,5.7407407407407405,1.347,27,6.714285714285714,0.784,21,95.23809523809523,0.7857142857142857,28,3.6666666666666665,2.418,27,94.44444444444444,18,4.761904761904762,1.091,21,3.5,1.792,20,21,6
971,Ser conejillo de indias,To be a guinea pig,Sujeto con el que se experimenta,Subject to be experimented with,5.142857142857143,1.526,21,5.85,1.785,20,90.0,0.5,22,3.0,1.859,23,88.88888888888889,18,2.1904761904761907,1.327,21,3.4545454545454546,1.535,22,20,4
972,Ser corto de miras,To be short-sighted,Torpe de entendimiento,Clumsy in understanding,3.7666666666666666,2.029,30,4.428571428571429,2.42,21,57.14285714285714,0.2608695652173913,23,2.8421052631578947,2.167,19,13.043478260869565,23,1.6538461538461537,0.689,26,3.0869565217391304,1.929,23,15,4
973,Ser coser y cantar,That is sewing and singing,Muy fácil,Very easy,4.7272727272727275,2.028,22,5.909090909090909,2.266,22,86.36363636363636,0.44,25,3.176470588235294,2.215,17,64.70588235294117,17,5.7727272727272725,1.066,22,4.958333333333333,1.681,24,15,4
974,Ser cuatro gatos,To be four cats,Poca gente,Few people,5.037037037037037,1.99,27,6.333333333333333,1.798,21,90.47619047619048,0.5217391304347826,23,4.36,2.271,25,84.21052631578947,19,2.909090909090909,1.109,22,2.25,1.293,20,14,3
975,Ser culo de mal asiento,To be a bad ass,"Ser inquieto, no se centra en nada","Being restless, not focused on anything",3.225806451612903,2.305,31,4.285714285714286,2.686,21,71.42857142857143,0.46153846153846156,26,3.5454545454545454,1.654,22,55.55555555555556,18,2.2666666666666666,1.335,15,2.9523809523809526,1.91,21,19,5
976,Ser de la virgen del puño,To be of the virgin of the fist,Ser tacaño,Being stingy,2.75,2.149,20,3.25,2.468,20,55.00000000000001,0.03571428571428571,28,1.9473684210526316,1.224,19,5.0,20,2.0,1.095,6,3.411764705882353,1.698,17,20,6
977,Ser de mírame y no me toques,To be of look at me and don't touch me,Ser muy frágil,Very fragile,3.6,2.162,20,4.55,2.259,20,65.0,0.6521739130434783,23,4.739130434782608,1.936,23,60.0,20,2.375,1.088,16,3.0833333333333335,1.53,24,22,7
978,Ser del año de la pera,To be from the year of the pear,Muy antiguo,Very old,4.24,2.296,25,5.9523809523809526,2.109,21,85.71428571428571,0.2727272727272727,22,1.9545454545454546,1.495,22,13.043478260869565,23,3.6842105263157894,1.416,19,2.7,1.261,20,17,6
979,Ser del año del hambre,To be from the year of hunger,Ser muy antiguo,Being very old,1.7096774193548387,1.321,31,2.5714285714285716,2.063,21,19.047619047619047,0.2608695652173913,23,3.5789473684210527,2.219,19,0.0,20,2.75,1.545,12,2.7857142857142856,1.762,14,18,5
980,Ser el alma de la fiesta,To be the life of the party,Muy divertido,Very funny,6.4,0.913,25,6.619047619047619,1.117,21,100.0,0.6956521739130435,23,3.375,2.374,24,89.47368421052632,19,6.409090909090909,0.959,22,5.909090909090909,1.151,22,19,6
981,Ser el brazo derecho de alguien,To be someone's right arm,Persona de máxima confianza,Very trustworthy person,5.214285714285714,1.729,28,6.473684210526316,0.612,19,100.0,0.5416666666666666,24,3.210526315789474,2.043,19,82.35294117647058,17,6.052631578947368,0.848,19,4.461538461538462,1.902,26,26,6
982,Ser el chivo expiatorio,To be the scapegoat,Se culpa a alguien inocente,Blame someone innocent,3.5238095238095237,2.112,21,5.05,2.305,20,30.0,0.2608695652173913,23,4.565217391304348,1.973,23,52.38095238095239,21,1.8888888888888888,1.023,18,4.333333333333333,1.534,18,20,4
983,Ser el ojito derecho,To be the right eye,De máxima confianza y cariño,Of the utmost trust and affection,5.142857142857143,1.711,21,5.888888888888889,1.745,18,83.33333333333334,0.08333333333333333,24,3.1,1.917,20,95.0,20,5.6923076923076925,0.97,26,4.619047619047619,1.802,21,17,4
984,Ser el pan de cada día,To be the bread of each day,Ser lo habitual,Being the usual,5.2592592592592595,1.992,27,6.142857142857143,1.153,21,100.0,0.782608695652174,23,3.7037037037037037,2.267,27,100.0,20,4.7,1.342,20,3.0555555555555554,1.765,18,17,6
985,Ser el tuerto en el país de los ciegos,To be the one-eyed man in the land of the blind,Lo mediano parece bueno entre lo malo,The medium seems good among the bad,2.857142857142857,2.032,21,3.25,2.489,20,20.0,0.5217391304347826,23,3.25,1.997,20,50.0,20,4.823529411764706,2.069,17,4.642857142857143,1.393,14,30,9
986,Ser el último de la fila,To be the last in line,El menos importante,The least important,4.095238095238095,1.895,21,4.4,2.558,15,66.66666666666666,0.5714285714285714,21,6.428571428571429,1.399,21,31.57894736842105,19,2.2222222222222223,0.892,27,2.05,1.276,20,19,6
987,Ser el último mono,To be the last monkey,"Insignificante, no contar para nada.","Insignificant, not counting for anything.",2.3214285714285716,1.964,28,4.421052631578948,2.631,19,68.42105263157895,0.52,25,3.823529411764706,1.944,17,57.89473684210527,19,1.8666666666666667,0.834,15,2.3157894736842106,1.157,19,15,4
988,Ser flor de un día,To be the flower of a day,No durar,Not lasting,2.857142857142857,1.824,21,3.75,2.511,20,30.0,0.6923076923076923,26,2.772727272727273,1.51,22,21.73913043478261,23,3.1052631578947367,1.997,19,3.9411764705882355,1.713,17,14,5
989,Ser harina de otro costal,To be flour from a different container,Ajeno o diferente de la cosa con la que se compara,Foreign or different from the thing to which it is compared.,2.142857142857143,1.711,21,2.4444444444444446,1.688,18,35.294117647058826,0.2,30,3.1538461538461537,2.075,13,25.0,20,3.6538461538461537,0.846,26,3.5,1.414,16,21,5
990,Ser la alegría de la huerta,To be the joy of the garden,Ser muy alegre,To be very cheerful,6.041666666666667,1.16,24,6.684210526315789,0.582,19,100.0,0.6363636363636364,22,2.590909090909091,2.13,22,73.68421052631578,19,6.296296296296297,1.489,27,6.35,0.671,20,22,6
991,Ser la caña,To be the reed,"Excepcional, sobresaliente","Exceptional, outstanding",6.136363636363637,1.125,22,6.636363636363637,0.79,22,100.0,0.23809523809523808,21,2.0555555555555554,1.305,18,0.0,21,6.72,0.614,25,6.111111111111111,1.188,27,9,3
992,Ser la gallina de los huevos de oro,To be the hen that lays the golden eggs,Ser muy valioso,To be very valuable,3.9523809523809526,1.857,21,4.55,2.188,20,50.0,0.6428571428571429,28,2.652173913043478,1.799,23,70.0,20,5.55,1.701,20,4.444444444444445,1.464,18,28,8
993,Ser la gota que colma el vaso,To be the drop that pours the glass,Lo que excede la paciencia,That which exceeds patience,5.714285714285714,1.347,21,6.733333333333333,0.458,15,100.0,0.8,25,4.476190476190476,2.228,21,91.30434782608695,23,1.7857142857142858,0.957,28,4.956521739130435,1.492,23,23,7
994,Ser la mano derecha de alguien,To be someone's right hand,Máximo colaborador,Maximum collaborator,5.4,1.384,25,6.571428571428571,0.978,21,100.0,0.43478260869565216,23,2.7916666666666665,2.021,24,55.55555555555556,18,6.181818181818182,1.006,22,4.090909090909091,1.601,22,25,6
995,Ser la manzana de la discordia,To be the apple of discord,Asunto habitual de discusión o disputa,Habitual subject of discussion or dispute,1.8571428571428572,1.407,28,3.210526315789474,2.2,19,47.368421052631575,0.2,30,2.466666666666667,1.922,15,21.73913043478261,23,2.076923076923077,0.641,13,3.7333333333333334,2.154,15,25,6
996,Ser la manzana podrida del cesto,To be the rotten apple in the basket,El mal que puede contagiar a los demás,Evil that can spread to others,2.5185185185185186,1.014,27,4.333333333333333,2.082,21,66.66666666666666,0.7272727272727273,22,4.0,2.253,27,5.88235294117647,17,1.4285714285714286,0.676,21,4.0,2.0,16,27,6
997,Ser la media naranja,To be the half of the orange,Pareja perfecta,Perfect partner,5.857142857142857,1.352,21,6.904761904761905,0.301,20,95.23809523809523,0.56,25,2.409090909090909,1.652,22,75.0,20,6.238095238095238,0.944,22,4.52,1.982,25,17,4
998,Ser la oveja negra,To be the black sheep,El más desfavorecido o desvalido,The most underprivileged or helpless,5.9,1.832,20,6.6,0.754,20,100.0,0.6538461538461539,26,4.434782608695652,2.063,23,91.30434782608695,23,1.2777777777777777,0.752,18,3.64,1.705,25,15,4
999,Ser la pera,To be the pear,Extraordinario,Extraordinary,4.962962962962963,1.743,27,6.523809523809524,0.75,21,90.47619047619048,0.07142857142857142,28,2.3076923076923075,1.594,26,2.4390243902439024,21,6.2272727272727275,1.541,22,4.2,2.262,20,9,3
1000,Ser mano de santo,To be a Saint's hand,Buen remedio,Good remedy,5.185185185185185,1.798,27,4.238095238095238,2.7,21,52.38095238095239,0.52,25,2.5185185185185186,1.868,27,77.77777777777779,18,6.285714285714286,1.007,21,3.4,1.818,20,14,4
1001,Ser más bueno que el pan,To be better than bread,Muy bueno,Very good,6.409090909090909,0.959,22,6.7272727272727275,0.883,22,95.45454545454545,0.8,30,3.388888888888889,2.004,18,72.22222222222221,18,6.32,1.345,25,4.444444444444445,1.987,27,19,6
1002,Ser más claro que el agua,To be clearer than water,Ser evidente,To be obvious,6.071428571428571,1.215,28,6.631578947368421,0.684,19,100.0,0.9565217391304348,23,4.684210526315789,2.001,19,100.0,20,6.0,0.882,19,4.6923076923076925,1.569,26,20,6
1003,Ser más falso que un billete de 1500,To be faker than a 1500 dollar bill,Ser muy falso,Being very fake,3.4285714285714284,2.357,21,6.666666666666667,0.485,18,100.0,0.9285714285714286,28,4.35,2.621,20,0.0,20,1.5,0.707,26,3.8095238095238093,2.159,21,29,8
1004,Ser más feo que Picio,To be uglier than Picio,Ser muy feo,To be very ugly,4.4,2.257,20,5.75,1.773,20,100.0,0.8,30,3.8260869565217392,1.922,23,27.77777777777778,18,1.3125,0.602,16,3.32,1.819,25,17,5
1005,Ser más largo que la cuaresma,To be longer than Lent,De mucha duración,Very long lasting,2.4583333333333335,1.444,24,3.3684210526315788,2.266,19,73.68421052631578,0.7727272727272727,22,2.888888888888889,2.139,18,5.263157894736842,19,2.6,1.354,25,3.3157894736842106,1.765,19,24,6
1006,Ser más lento que una tortuga,To be slower than a turtle,Muy lento,Very slow,6.363636363636363,1.002,22,6.818181818181818,0.501,22,100.0,1.0,23,5.555555555555555,1.542,18,94.11764705882352,17,2.32,0.9,25,1.8888888888888888,1.528,27,24,6
1007,Ser más viejo que Matusalén,To be older than Methuselah,Muy viejo,Very old,5.2727272727272725,1.956,22,6.636363636363637,0.79,22,100.0,0.8846153846153846,26,5.222222222222222,1.517,18,34.78260869565217,23,2.75,1.189,24,2.52,1.828,25,23,5
1008,Ser más viejo que un camino,To be older than a road,Ser muy viejo,To be very old,1.8095238095238095,1.47,21,6.111111111111111,1.183,18,100.0,0.8695652173913043,23,5.529411764705882,2.183,17,0.0,17,3.217391304347826,1.347,23,2.9,1.744,20,22,6
1009,Ser miel sobre hojuelas,To be honey over flakes,Una cosa realza a otra,One thing enhances another,1.2857142857142858,1.309,21,1.2666666666666666,0.799,15,0.0,0.19047619047619047,21,2.8461538461538463,2.304,13,20.0,20,4.2727272727272725,1.902,11,3.7142857142857144,2.628,7,20,4
1010,Ser pan comido,To be eaten bread,Ser muy fácil de conseguir,Being very easy to get,6.142857142857143,1.062,21,6.619047619047619,1.322,20,90.47619047619048,0.5454545454545454,22,3.090909090909091,2.068,22,36.84210526315789,19,6.095238095238095,1.044,22,3.32,1.819,25,12,3
1011,Ser papel mojado,To be wet paper,Cosa inútil o inconsistente,A useless or inconsistent thing,2.3214285714285716,1.657,28,1.368421052631579,0.684,19,15.789473684210526,0.3,30,4.0,2.0,16,22.22222222222222,18,2.5833333333333335,1.084,12,2.1,0.968,20,14,3
1012,Ser pasto de las llamas,To be grass for the flames,Algo que arde,Something that burns,2.619047619047619,1.936,21,2.9444444444444446,2.261,18,33.33333333333333,0.36,25,3.6666666666666665,2.249,18,15.789473684210526,19,1.8461538461538463,0.925,26,3.4210526315789473,1.805,19,19,5
1013,Ser piel y huesos,To be skin and bones,Muy delgado,Very thin,2.5238095238095237,1.99,21,4.85,2.3,20,80.0,0.9166666666666666,24,4.478260869565218,2.064,23,38.095238095238095,21,2.0555555555555554,0.802,18,3.3076923076923075,1.702,13,14,4
1014,Ser rata de laboratorio,To be lab rats,Sujeto con el que se experimenta,Subject to be experimented with,3.925925925925926,2.252,27,5.0476190476190474,2.355,21,30.0,0.8333333333333334,24,4.296296296296297,2.284,27,15.789473684210526,19,2.1363636363636362,1.207,22,3.5789473684210527,1.924,19,20,4
1015,Ser terreno pantanoso,To be swampy ground,Lleno de inconvenientes u obstáculos,Full of inconveniences or obstacles,3.4761904761904763,1.806,21,4.8,2.419,20,40.0,0.6666666666666666,30,4.521739130434782,2.02,23,16.666666666666664,18,1.9473684210526316,0.848,19,4.0,1.528,19,19,3
