numerical_id,idiom,idiom_literal_translation,idiomatic_meaning,idiomatic_meaning_translation,familiarity,sd_familiarity,n_familiarity,knowledge,sd_knowledge,n_knowledge,knowledge_%,decomposability,n_decomposability,literality,sd_literality,n_literality,predictability_%,n_predictability,valence,sd_valence,n_valence,arousal,sd_arousal,n_arousal,length_in_letters,length_in_words
556,Ir en piloto automático,Go on autopilot,Hacer algo por inercia,Doing something by inertia,2.9285714285714284,2.142,28,4.2631578947368425,1.939,19,73.68421052631578,0.5217391304347826,23,5.0625,1.652,16,76.47058823529412,17,3.6666666666666665,1.073,12,2.9,1.619,20,20,4
557,Ir hecho un pincel,Go made a brush,Vestir de forma muy elegante,Dressing very smartly,5.0,1.927,22,6.409090909090909,1.403,22,100.0,0.16,25,2.111111111111111,1.676,18,20.0,20,5.083333333333333,2.041,24,4.115384615384615,1.925,26,15,4
558,Ir por la vía rápida,Go in the fast lane,Actuar de manera expeditiva,Acting in an expeditious manner,4.074074074074074,1.708,27,5.571428571428571,2.014,21,95.23809523809523,0.92,25,6.296296296296297,1.031,27,26.08695652173913,23,3.772727272727273,1.27,22,3.0,1.686,20,16,5
559,Ir trompa,Go drunk,Ir bebido,Being drunk,3.75,2.09,24,5.7894736842105265,1.813,19,89.47368421052632,0.16,25,1.6666666666666667,1.029,18,0.0,20,3.125,1.624,24,3.3157894736842106,2.136,19,8,2
560,Ir viento en popa,Go with wind in poop,Las cosas van bien,Things are going well,5.7272727272727275,1.609,22,6.818181818181818,0.501,22,95.45454545454545,0.6818181818181818,22,4.777777777777778,2.074,18,85.71428571428571,21,6.4,0.764,25,5.346153846153846,1.696,26,14,4
561,Irse a dormir calentito,Go to sleep warm,Acostarse tras haber recibido un azote,Going to bed after having been spanked,4.454545454545454,2.087,22,4.409090909090909,2.684,22,50.0,0.3181818181818182,22,5.222222222222222,1.555,18,0.0,20,3.5833333333333335,2.145,24,4.68,1.93,25,20,4
562,Irse al garete,Go down the drain,"Fracasar, estropearse o malograrse","To fail, to spoil, or to go wrong",4.7407407407407405,1.534,27,5.9523809523809526,1.322,21,80.95238095238095,0.391304347826087,23,3.04,2.131,25,16.666666666666664,18,2.090909090909091,1.306,22,3.25,1.773,20,12,3
563,Irse al infierno,Go to hell,"Se le dice a alguien que molesta, para que deje de molestar","It is said to someone who is annoying, so that he stops annoying",4.625,1.861,24,5.7894736842105265,1.357,19,52.63157894736842,0.7391304347826086,23,2.0,1.927,22,10.0,20,1.6071428571428572,0.916,28,3.3,1.78,20,14,3
564,Irse al quinto pino,Go to the fifth pine,Ir muy lejos,To go too far,5.703703703703703,1.436,27,6.857142857142857,0.478,21,100.0,0.6785714285714286,28,4.730769230769231,1.991,26,77.77777777777779,18,3.0,1.024,22,3.45,2.139,20,16,4
565,Irse con el rabo entre las piernas,Go with your tail between your legs,Haber sido vencido o humillado,To have been beaten or humiliated,4.64,1.469,25,6.0,1.817,21,80.95238095238095,0.5,26,3.782608695652174,1.999,23,78.26086956521739,23,2.238095238095238,0.995,21,3.142857142857143,1.526,21,28,7
566,Irse de la lengua,Go off the tongue,Decir algo que no se debía decir,To say something that should not have been said,5.642857142857143,1.283,28,6.421052631578948,1.502,19,94.73684210526315,0.5666666666666667,30,3.1052631578947367,2.079,19,47.368421052631575,19,1.894736842105263,0.809,19,3.4615384615384617,1.838,26,14,4
567,Irse de la pinza,Go off the clothespin,Ser irracional,To be irrational,5.45,1.538,20,6.1,1.483,20,95.0,0.2916666666666667,24,2.590909090909091,1.532,22,33.33333333333333,18,2.5555555555555554,1.097,18,4.84,1.491,25,13,4
568,Irse de las manos,To go away of the hands,Perder el control de algo,To lose control of something,6.095238095238095,1.48,21,6.190476190476191,1.692,20,80.95238095238095,0.8,25,3.5238095238095237,2.272,21,42.857142857142854,21,2.142857142857143,1.014,22,3.92,1.847,25,14,4
569,Irse de picos pardos,To go away of brown beaks,Irse de juerga o diversión,Going on a spree or having fun,3.225806451612903,2.473,31,3.619047619047619,2.418,21,38.095238095238095,0.04,25,2.0476190476190474,1.322,21,68.42105263157895,19,4.923076923076923,2.06,13,4.722222222222222,1.742,18,17,4
570,Irse de rositas,To go away of little roses,Se obtiene algo sin esfuerzo y sin consecuencias negativas,Obtaining something without effort and without negative consequences,5.5,1.504,20,6.65,0.933,20,95.0,0.23333333333333334,30,2.869565217391304,1.866,23,35.0,20,3.9444444444444446,2.155,18,3.75,1.26,24,13,3
571,Irse el santo al cielo,The saint goes to heaven,Despistarse,Get distracted,5.1,1.651,20,5.3,2.055,20,75.0,0.08695652173913043,23,3.4782608695652173,2.086,23,94.73684210526315,19,2.8333333333333335,0.985,18,3.24,1.69,25,18,5
572,Irse por las patas abajo,Going down by the legs,Cagarse encima (o tener mucho miedo),Shitting oneself (or being very afraid),5.037037037037037,1.605,27,3.857142857142857,2.535,21,57.14285714285714,0.34615384615384615,26,2.6153846153846154,1.92,26,57.89473684210527,19,2.0,1.17,20,4.0,2.028,19,20,5
573,Irse por los cerros de Úbeda,Go through the hills of Úbeda,Divagar,Rambling,4.238095238095238,2.385,21,4.222222222222222,2.487,18,72.22222222222221,0.041666666666666664,24,4.888888888888889,2.055,18,52.17391304347826,23,2.576923076923077,0.857,26,3.111111111111111,1.875,18,23,6
574,Joder la marrana,Fuck the pig,Fastidiar,To annoy,4.129032258064516,2.232,31,5.095238095238095,2.211,21,76.19047619047619,0.2857142857142857,28,2.8636363636363638,1.642,22,33.33333333333333,21,1.9473684210526316,1.393,19,3.6818181818181817,1.887,22,14,3
575,Jugar al gato y al ratón,Playing cat and mouse,Buscarse sin llegar a encontrarse,Looking for someone without wanting to find them,3.761904761904762,2.234,21,4.65,2.059,20,45.0,0.625,24,3.608695652173913,1.924,23,70.0,20,3.473684210526316,1.467,19,3.9523809523809526,1.884,21,19,6
576,Jugar con fuego,Playing with fire,Ser imprudente en una situación con consecuencias negativas,Being reckless in a situation with negative consequences,6.28,1.021,25,6.523809523809524,1.078,21,100.0,0.782608695652174,23,4.833333333333333,1.993,24,70.58823529411765,17,2.1818181818181817,1.14,22,5.636363636363637,1.002,22,13,3
577,Jugar en otra liga,Playing in another league,Ser superior,Being superior,4.592592592592593,1.966,27,5.9523809523809526,1.774,21,85.71428571428571,0.6666666666666666,24,5.769230769230769,1.657,26,66.66666666666666,18,5.136363636363637,1.167,22,4.3,1.867,20,15,4
578,Jugar la última carta,Playing the last card,Emplear el último recurso,Using the last resort,3.933333333333333,2.132,30,5.857142857142857,1.315,21,71.42857142857143,0.9166666666666666,24,5.421052631578948,2.317,19,50.0,18,4.285714285714286,1.15,28,5.103448275862069,1.543,29,18,4
579,Jugar limpio,Play fair,Sin trampas,Without cheating,6.363636363636363,0.848,22,6.818181818181818,0.501,22,100.0,0.8333333333333334,24,4.722222222222222,1.994,18,0.0,19,6.24,0.97,25,4.296296296296297,2.072,27,11,2
580,Juntarse el hambre con las ganas de comer,To join hunger with the desire to eat,Convergen dos cosas de la misma condición,Two things of the same condition converge,5.774193548387097,1.668,31,5.428571428571429,2.204,21,80.95238095238095,0.5769230769230769,26,3.909090909090909,2.223,22,60.0,20,3.25,1.832,20,3.5,2.11,22,34,8
581,La cosa está que arde,Things are on fire,La situación es complicada,The situation is complicated,5.55,1.849,20,6.1,1.41,20,95.0,0.5666666666666667,30,4.956521739130435,1.637,23,65.0,20,3.388888888888889,1.42,18,5.68,1.145,25,17,5
582,La fe mueve montañas,Faith moves mountains,La confianza y la esperanza son aliados para conseguir lo difícil,Confidence and hope are allies to achieve what is difficult,4.321428571428571,1.786,28,5.2631578947368425,1.881,19,78.94736842105263,0.72,25,2.6315789473684212,2.006,19,50.0,20,5.75,1.0,16,4.3076923076923075,2.223,26,17,4
583,La mar de bien,The sea of good,Muy bien,Very well,6.318181818181818,0.995,22,6.7272727272727275,0.767,22,100.0,0.7391304347826086,23,2.5555555555555554,1.822,18,38.88888888888889,18,6.6,0.577,25,5.333333333333333,1.494,27,11,4
584,La ocasión la pintan calva,The occasion is a bald one,Las oportunidades se deben aprovechar,Opportunities must be seized,2.142857142857143,1.315,21,3.142857142857143,2.707,20,19.047619047619047,0.0,23,1.588235294117647,1.278,17,0.0,20,4.1,1.792,11,3.8095238095238093,1.806,21,22,5
585,Labrarse un porvenir,To carve out a future,Trabajar para tener un buen trabajo en el futuro,Work to have a good job in the future,2.142857142857143,1.407,28,5.052631578947368,2.121,19,89.47368421052632,0.6086956521739131,23,2.6470588235294117,2.09,17,0.0,20,5.615384615384615,1.446,13,4.666666666666667,1.68,18,18,3
586,Lamerse las heridas,Licking your wounds,Asimilar una derrota,Assimilate a defeat,3.6666666666666665,1.77,21,3.7222222222222223,1.776,18,61.111111111111114,0.13043478260869565,23,5.368421052631579,1.978,19,60.0,20,3.16,1.344,25,2.85,1.694,20,17,3
587,Las armas las carga el diablo,Weapons are loaded by the devil,Algo aparentemente inofensivo puede implicar riesgos,Something seemingly harmless may involve risks,3.962962962962963,1.581,27,3.380952380952381,2.269,21,47.61904761904761,0.25,24,2.9583333333333335,2.236,24,40.0,20,2.238095238095238,1.7,21,4.631578947368421,1.499,19,24,6
588,Las paredes oyen,The walls hear,Prudencia al decir algo que pueda comprometernos,Prudence in saying something that may compromise us,4.68,1.345,25,5.904761904761905,1.758,21,52.38095238095239,0.5909090909090909,22,2.2083333333333335,1.744,24,25.0,20,2.8181818181818183,1.296,22,2.95,1.432,20,14,3
589,Lavar la ropa sucia en casa,Washing dirty clothes at home,No hacer público un asunto privado,Do not make a private matter public,2.68,2.036,25,4.0,2.366,21,57.14285714285714,0.32,25,5.619047619047619,2.061,21,30.434782608695656,23,3.5625,1.861,16,2.6,1.352,15,22,6
590,Lavarle la cara a algo,Washing something's face,Adecentar,Decorate something,3.6451612903225805,2.43,31,3.4285714285714284,2.461,21,33.33333333333333,0.32,25,4.863636363636363,1.612,22,0.0,20,5.3125,1.58,16,3.1,1.917,20,18,5
591,Lavarse las manos,Washing hands,Desentenderse de un asunto,Disengaging from a matter,5.833333333333333,1.621,30,6.428571428571429,0.978,21,100.0,0.36363636363636365,22,6.190476190476191,1.632,21,89.47368421052632,19,2.9285714285714284,1.215,28,3.2857142857142856,1.863,28,15,3
592,Leer la cartilla,Reading the primer,Reprender a alguien,Reprimanding someone,3.25,2.084,28,4.684210526315789,2.496,19,57.89473684210527,0.08695652173913043,23,5.722222222222222,1.565,18,5.88235294117647,17,2.5,1.092,14,2.764705882352941,1.48,17,14,3
593,Leerle el pensamiento a alguien,Reading someone's mind,Adivinar las intenciones de una persona,Guessing a person's intentions,6.3,1.149,30,6.380952380952381,0.921,21,95.23809523809523,0.9666666666666667,30,3.2857142857142856,2.194,21,72.22222222222221,18,5.172413793103448,1.002,29,4.275862068965517,1.688,29,27,5
594,Levantar ampollas,Make blisters come out,Causar disgusto/desasosiego,To cause displeasure/unpleasantness,2.5454545454545454,2.22,22,2.409090909090909,2.282,22,18.181818181818183,0.24,25,3.533333333333333,2.264,15,4.3478260869565215,23,2.0625,1.436,16,3.9375,1.526,16,16,2
595,Levantar la liebre,Make the hare come out,Dar a conocer un asunto que estaba oculto,To make known a matter that was hidden,2.05,1.669,20,2.05,1.761,20,25.0,0.0,23,4.7,2.25,20,0.0,20,4.333333333333333,1.414,9,4.5,1.557,14,16,3
596,Levantarse con el pie izquierdo,Getting up on the left foot,Empezar algo con desacierto,To start something unwisely,6.333333333333333,1.197,21,6.714285714285714,0.463,20,95.23809523809523,0.2727272727272727,22,5.863636363636363,1.885,22,90.0,20,1.7142857142857142,0.717,22,3.04,1.428,25,27,5
597,Levar anclas,Anchors aweigh,Ponerse en marcha,Getting started,2.761904761904762,1.998,21,4.0476190476190474,2.674,20,42.857142857142854,0.6086956521739131,23,6.052631578947368,1.682,19,31.57894736842105,19,5.235294117647059,1.437,18,4.260869565217392,1.815,23,11,2
598,Liarla parda,Brown fuss,Meterse en un buen lío,To get into trouble,6.2,1.196,20,6.6,0.503,20,100.0,0.8636363636363636,22,2.1739130434782608,1.85,23,76.19047619047619,21,2.2222222222222223,0.878,18,5.72,1.514,25,11,2
599,Liarse la manta a la cabeza,Pulling the blanket over one's head,Decidirse sin albergar duda,To make up one's mind without doubt,3.033333333333333,2.442,30,2.4285714285714284,2.249,21,19.047619047619047,0.041666666666666664,24,5.470588235294118,2.125,17,56.52173913043478,23,3.9473684210526314,1.649,19,4.1,1.971,20,22,6
600,Limar asperezas,To file down the roughness,Conciliar y vencer dificultades,To reconcile and overcome difficulties,3.9,2.174,20,4.25,2.693,20,60.0,0.25,28,5.608695652173913,1.777,23,30.434782608695656,23,5.166666666666667,0.985,18,3.3181818181818183,1.555,22,14,2
601,Limpiar el nombre de alguien,Clearing someone's name,Deshacerse de la mala reputación,Getting rid of a bad reputation,3.1481481481481484,1.512,27,5.095238095238095,1.841,21,71.42857142857143,0.5833333333333334,24,4.0,2.418,27,33.33333333333333,18,5.4,1.142,20,3.35,1.785,20,24,5
602,Llamar las cosas por su nombre,Calling things by their name,Decir las cosas claramente,Saying things clearly,5.633333333333334,1.402,30,6.476190476190476,1.436,21,85.71428571428571,1.0,28,5.714285714285714,1.875,21,100.0,19,4.9655172413793105,1.18,29,3.8275862068965516,1.965,29,25,6
603,Llegar a buen puerto,Getting to good port,Concluir con éxito,Conclude successfully,4.935483870967742,1.769,31,5.571428571428571,1.63,21,76.19047619047619,0.5217391304347826,23,5.318181818181818,1.862,22,42.857142857142854,21,6.45,0.759,20,4.904761904761905,1.729,21,17,4
604,Llegar con las manos vacías,Coming up empty-handed,Volver sin haber obtenido algo deseado,Returning without having obtained something desired,5.285714285714286,1.793,21,6.3,1.174,20,95.0,0.9565217391304348,23,5.956521739130435,1.87,23,35.0,20,2.0952380952380953,0.944,21,2.5,0.859,22,23,5
605,Llegar hasta el fondo de la cuestión,Getting to the bottom of the issue,Ir al núcleo de un asunto o problema,Getting to the heart of an issue or problem,4.761904761904762,1.868,21,6.35,0.813,20,100.0,1.0,26,4.0,2.132,23,22.22222222222222,18,5.523809523809524,1.209,21,4.863636363636363,1.699,22,30,7
606,Llegar por los pelos,Getting there by the hair,Llegar con el tiempo casi cumplido,Arriving with time almost up,6.285714285714286,0.897,28,6.842105263157895,0.375,19,94.73684210526315,0.36,25,2.736842105263158,1.968,19,55.00000000000001,20,3.3333333333333335,1.029,18,4.038461538461538,2.049,26,17,4
607,Llegar y besar el santo,To arrive and kiss the saint,Obtener algo en un breve espacio de tiempo,To obtain something in a short period of time,3.5238095238095237,2.4,21,5.6,1.682,15,86.66666666666667,0.30434782608695654,23,4.190476190476191,2.695,21,65.0,20,6.08,0.997,25,4.368421052631579,1.802,19,19,5
608,Llevar al huerto,To take to the orchard,Lograr convercer a alguien,To succeed in converting someone,4.774193548387097,2.109,31,5.523809523809524,1.861,21,90.47619047619048,0.043478260869565216,23,5.136363636363637,2.274,22,26.31578947368421,19,4.823529411764706,1.51,17,4.909090909090909,1.509,22,14,3
609,Llevar el agua a su molino,To take the water to his/her mill,Dirigir las cosas hacia un beneficio propio,Directing things to one's own advantage,1.6,1.258,25,3.142857142857143,2.265,21,38.095238095238095,0.30434782608695654,23,4.9,2.337,20,11.76470588235294,17,4.928571428571429,1.328,14,3.375,1.36,16,21,6
610,Llevar en volandas,To carry through the air,Facilitar las cosas a alguien,Make things easier for someone,4.225806451612903,2.156,31,4.0476190476190474,2.479,21,14.285714285714285,0.08695652173913043,23,3.4545454545454546,1.896,22,10.526315789473683,19,4.176470588235294,1.59,17,3.4285714285714284,1.66,21,16,3
611,Llevar una buena trompa,To carry a good drunkenness,Ir borracho,To go drunk,3.9166666666666665,2.104,24,5.473684210526316,2.195,19,84.21052631578947,0.041666666666666664,24,4.421052631578948,2.116,19,0.0,20,2.9,1.334,20,3.789473684210526,1.903,19,20,4
612,Llevar una vida de perros,To lead a dog's life,Con muchos sufrimientos,With a lot of suffering,5.0476190476190474,1.687,21,5.7,1.72,20,65.0,0.32142857142857145,28,3.0869565217391304,1.857,23,33.33333333333333,18,2.0,1.225,21,3.8636363636363638,1.612,22,21,5
613,Llevarlo claro,Carry it clear,Tenerlo muy difícil,Having a very hard time,6.0,1.304,21,5.222222222222222,1.801,18,50.0,0.19047619047619047,21,4.05,2.164,20,5.555555555555555,18,3.230769230769231,1.394,26,3.0,1.483,21,13,2
614,Llevarse como el perro y el gato,To get on like a dog and a cat,Aborrecerse mutuamente dos personas,Mutual abhorrence,5.48,1.782,25,6.619047619047619,0.973,21,90.47619047619048,0.88,25,4.3478260869565215,2.347,23,100.0,21,1.7727272727272727,1.066,22,4.590909090909091,1.563,22,26,7
615,Llevarse el gato al agua,To take the cat to the water,Triunfar en una competencia,Succeeding in a competition,3.4,2.159,30,3.5714285714285716,2.694,21,38.095238095238095,0.16666666666666666,24,5.0,2.317,20,47.82608695652174,23,4.521739130434782,1.41,23,3.869565217391304,1.792,23,20,5
616,Llevarse un chasco,To take a disappointment,Decepcionarse por algo,Being disappointed by something,5.4,1.78,25,6.523809523809524,1.365,21,95.23809523809523,0.5238095238095238,21,2.625,1.61,24,10.0,20,1.5909090909090908,0.908,22,3.272727272727273,1.579,22,16,3
617,Llorar como un descosido,Crying as a burst seam,Llorar mucho,Crying a lot,4.36,1.846,25,6.285714285714286,1.648,21,95.23809523809523,0.6923076923076923,26,2.772727272727273,2.092,22,5.555555555555555,18,2.0476190476190474,1.396,21,3.8181818181818183,2.218,22,21,4
618,Llorar como una magdalena,Crying like a cupcake,Llorar desconsoladamente,Crying inconsolably,5.935483870967742,1.209,31,6.809523809523809,0.512,21,100.0,0.42857142857142855,28,1.7272727272727273,1.352,22,44.44444444444444,18,2.0952380952380953,1.136,21,3.8636363636363638,2.031,22,22,4
619,Llorar lágrimas de cocodrilo,Crying crocodile tears,Aparentar dolor que no siente,Appearing to be in pain that you don't feel,4.96,1.541,25,6.428571428571429,1.165,21,90.47619047619048,0.2916666666666667,24,2.1363636363636362,1.67,22,40.0,20,2.0,0.894,21,3.380952380952381,1.658,21,25,4
620,Llover hostias,Raining blows,Dar bofetadas,Slapping your face,4.444444444444445,2.025,27,5.857142857142857,1.621,21,85.71428571428571,0.75,28,1.8846153846153846,1.275,26,0.0,19,1.4545454545454546,0.671,22,4.8,2.285,20,13,2
621,Llueve a cántaros,It's raining pitchers,"Llover con mucha fuerza, en abundancia","Raining heavily, abundantly",5.7272727272727275,1.352,22,6.818181818181818,0.501,22,100.0,0.9230769230769231,26,3.0,1.782,18,52.63157894736842,19,3.56,1.356,25,4.148148148148148,1.994,27,15,3
622,Lo cortés no quita lo valiente,The polite does not take away the brave,El respeto es compatible con defender la opinión personal,Respect is compatible with defending one's opinion,3.0952380952380953,2.189,21,2.142857142857143,2.128,20,19.047619047619047,0.3181818181818182,22,4.0476190476190474,1.987,21,23.52941176470588,17,4.333333333333333,0.816,16,3.260869565217391,1.711,23,25,6
623,Lo dicen las malas lenguas,So say the evil tongues,Personas que inventan chismes sobre los demás,People who invent gossip about others,4.580645161290323,1.803,31,5.428571428571429,2.039,21,80.95238095238095,0.5714285714285714,21,3.409090909090909,1.894,22,73.68421052631578,19,2.5238095238095237,1.25,21,2.55,1.191,20,22,5
624,Lo que no está en los escritos,What is not in the writings,Muchísimo,Very much,3.0357142857142856,2.252,28,2.4210526315789473,2.143,19,21.052631578947366,0.2608695652173913,23,4.0588235294117645,2.076,17,5.0,20,3.2941176470588234,0.985,17,3.25,2.017,16,24,7
625,Los árboles no te dejan ver el bosque,The trees don't let you see the forest,El detalle no deja ver el conjunto,The detail does not let you see the whole,1.8571428571428572,1.353,28,4.315789473684211,2.286,19,61.111111111111114,0.7391304347826086,23,5.823529411764706,1.667,17,30.0,20,2.9411764705882355,0.966,17,2.4545454545454546,1.143,22,30,8
626,Mala hierba nunca muere,Weeds never die,Lo malo persiste y no desaparece,Bad things persist and do not go away,5.571428571428571,1.832,21,6.4,1.095,20,85.0,0.92,25,4.0,1.883,23,88.88888888888889,18,2.3333333333333335,1.528,21,4.863636363636363,1.552,22,20,4
627,Manda huevos,Command eggs,Mezcla de sorpresa e indignación,Mix of surprise and indignation,5.761904761904762,1.64,21,5.388888888888889,1.29,18,100.0,0.04,25,3.210526315789474,2.323,19,50.0,20,2.3461538461538463,1.056,26,4.0476190476190474,1.857,21,11,2
628,Mandar a alguien a freir espárragos,Sending someone to fry asparagus,Despedir a alguien con enfado,Angrily dismissing someone,5.666666666666667,1.426,21,6.857142857142857,0.359,20,85.71428571428571,0.08695652173913043,23,5.181818181818182,2.322,22,10.0,20,1.9523809523809523,1.117,22,4.84,1.7,25,30,6
629,Mandar a alguien a paseo,Send someone for a stroll,Manifestar desagrado o rechazo por alguien,Showing dislike or rejection of someone,6.045454545454546,1.558,22,6.590909090909091,0.796,22,100.0,0.4583333333333333,24,5.111111111111111,1.779,18,84.21052631578947,19,2.44,1.502,25,3.8518518518518516,2.125,27,20,5
630,Mandar a alguien al diablo,Send someone to devil,Rechazar tajantemente a una persona,To reject a person outright,3.8095238095238093,1.778,21,6.133333333333334,1.06,15,93.33333333333333,0.8,30,2.6666666666666665,2.266,21,0.0,20,1.5357142857142858,0.793,28,4.7272727272727275,2.164,22,22,5
631,Mandar a la porra,Send someone to hell,Rechazar a alguien,Rejecting someone,5.380952380952381,1.499,21,6.4,0.883,20,85.0,0.21739130434782608,23,1.9565217391304348,1.581,23,0.0,21,1.9523809523809523,0.865,21,3.9545454545454546,1.889,22,14,4
632,Mantener a raya,To keep at bay,Dentro de los límites tolerados,Within tolerated limits,5.761904761904762,1.044,21,6.133333333333334,1.06,15,66.66666666666666,0.6428571428571429,28,3.142857142857143,2.056,21,34.78260869565217,23,4.230769230769231,1.107,26,3.227272727272727,1.572,22,13,3
633,Mantenerse firme,To stand firm,Persistir,Persist,5.35,1.387,20,6.8,0.41,20,100.0,0.8571428571428571,21,6.260869565217392,0.964,23,0.0,18,6.111111111111111,0.583,18,4.04,1.541,25,15,2
634,Marear la perdiz,To make dizzy the partridge,Perder tiempo con rodeos,Wasting time beating around the bush,5.709677419354839,1.465,31,6.190476190476191,0.981,21,100.0,0.34615384615384615,26,3.8636363636363638,1.885,22,94.73684210526315,19,2.3333333333333335,0.913,21,2.9545454545454546,1.588,22,14,3
635,Más vale pájaro en mano que ciento volando,Better a bird in the hand than a hundred in the air,Mejor poco seguro que mucho inseguro,Better a little safe than a lot unsafe,5.533333333333333,1.57,30,6.095238095238095,1.3,21,85.71428571428571,0.6956521739130435,23,3.7142857142857144,2.261,21,70.0,20,4.928571428571429,1.052,28,3.9642857142857144,1.551,28,35,8
636,Matar dos pájaros de un tiro,Kill two birds with one shoot,Lograr dos cosas de una vez,Accomplish two things at once,6.16,1.143,25,6.714285714285714,1.102,21,90.47619047619048,0.6521739130434783,23,4.958333333333333,2.074,24,100.0,17,5.954545454545454,1.29,22,5.318181818181818,1.211,22,23,6
637,Matar el gusanillo,Kill the bug,Calmar el hambre,To appease hunger,5.285714285714286,1.617,21,5.6,2.186,20,55.00000000000001,0.0,24,3.347826086956522,2.308,23,12.5,20,5.095238095238095,1.091,21,3.857142857142857,1.797,21,16,3
638,Matar el tiempo,Kill time,Distraerse para evitar el aburrimiento,Distract yourself to avoid boredom,5.642857142857143,1.367,28,6.421052631578948,0.902,19,100.0,0.5714285714285714,28,2.473684210526316,2.065,19,35.0,20,3.8421052631578947,1.344,19,2.730769230769231,1.485,26,13,3
639,Matar moscas a cañonazos,Kill flies with a cannon shot,Malgastar recursos en algo que no necesita tantos,Wasting resources on something that doesn't need so much,2.25,1.648,24,4.0,2.427,19,47.368421052631575,0.3333333333333333,24,2.5789473684210527,1.924,19,22.22222222222222,18,2.75,1.238,16,4.428571428571429,1.555,14,21,4
640,Matarlas callando,To kill them with silence,Maldades en secreto aparentando bondad,Secretly doing evil in the guise of goodness,4.571428571428571,2.098,28,3.3684210526315788,2.385,19,21.052631578947366,0.375,24,3.526315789473684,2.065,19,35.294117647058826,17,2.8421052631578947,1.537,19,3.782608695652174,1.976,23,16,2
641,Me las vi y me las deseé,I saw them and I wanted them,Tener una gran dificultad,Having a great difficulty,2.36,1.977,25,3.142857142857143,2.535,21,38.095238095238095,0.13043478260869565,23,3.076923076923077,1.553,13,34.78260869565217,23,3.25,0.754,12,4.388888888888889,1.195,18,18,7
642,Mear fuera de tiesto,Pissing out of the pot,Decir/hacer algo que no viene al caso,Saying/doing something that is irrelevant,3.8518518518518516,1.725,27,4.476190476190476,2.562,21,47.61904761904761,0.4090909090909091,22,5.222222222222222,2.006,27,41.17647058823529,17,2.05,0.826,20,3.066666666666667,1.944,15,17,4
643,Mear y no echar gota,Mear y no echar gota,Incredulidad o sorpresa desagradable,Disbelief or unpleasant surprise,2.92,1.778,25,4.904761904761905,2.427,21,47.61904761904761,0.13043478260869565,23,4.090909090909091,2.467,22,65.21739130434783,23,2.789473684210526,1.228,19,3.772727272727273,1.901,22,16,5
644,Medir tus palabras,Measuring your words,Hablar de forma comedida,Speaking in a measured way,5.65,1.725,20,6.5,0.827,20,100.0,0.8571428571428571,28,4.409090909090909,2.501,22,65.21739130434783,23,3.7222222222222223,1.674,18,3.04,1.567,25,16,3
645,Menos da una piedra,Less is a stone,Importante valorar lo pequeño,Important to appreciate the small things,4.962962962962963,1.87,27,3.7142857142857144,2.411,21,61.904761904761905,0.4583333333333333,24,2.88,2.279,25,39.130434782608695,23,3.3684210526315788,1.461,19,2.611111111111111,2.09,18,16,4
