numerical_id,idiom,idiom_literal_translation,idiomatic_meaning,idiomatic_meaning_translation,familiarity,sd_familiarity,n_familiarity,knowledge,sd_knowledge,n_knowledge,knowledge_%,decomposability,n_decomposability,literality,sd_literality,n_literality,predictability_%,n_predictability,valence,sd_valence,n_valence,arousal,sd_arousal,n_arousal,length_in_letters,length_in_words
274,Echar margaritas a los cerdos,Throwing daisies to the pigs,Darle a alguien algo que no valora ni merece,Giving someone something they don't value or deserve,1.3928571428571428,0.875,28,1.4210526315789473,1.17,19,5.263157894736842,0.19230769230769232,26,4.25,2.352,16,29.411764705882355,17,2.6666666666666665,1.633,6,2.75,1.288,12,25,5
275,Echar raíces,Take roots,Quedarse en un lugar de forma duradera,Staying in one place for a long time,4.7,1.705,30,5.333333333333333,1.742,21,61.904761904761905,0.8846153846153846,26,2.9047619047619047,2.427,21,15.0,20,5.310344827586207,1.072,29,3.888888888888889,1.625,27,11,2
276,Echar un jarro de agua fría,Pouring cold water,Quitar la ilusión ,Taking away the illusion ,4.809523809523809,2.136,21,5.809523809523809,1.721,20,71.42857142857143,0.3333333333333333,21,5.7727272727272725,1.688,22,94.44444444444444,18,2.35,0.933,21,4.04,1.719,25,22,6
277,Echar un ojo,To cast an eye,Vigilar,Watching,6.045454545454546,1.29,22,6.636363636363637,0.727,22,81.81818181818183,0.6818181818181818,22,3.8333333333333335,1.757,18,20.0,20,4.28,1.061,25,3.740740740740741,1.457,27,10,3
278,Echar una cabezada,To throw a head,Echar un sueño corto y ligero,"To take a short, light sleep",5.761904761904762,1.513,21,6.75,0.444,20,100.0,0.5357142857142857,28,3.5652173913043477,1.805,23,0.0,19,5.238095238095238,1.446,21,2.1904761904761907,1.47,21,16,3
279,Echar una cana al aire,Casting a gray hair in the air,Divertirse fuera de la norma,Having fun outside the norm,2.9523809523809526,1.802,21,2.1666666666666665,1.855,18,5.555555555555555,0.03333333333333333,30,3.588235294117647,2.399,17,50.0,20,4.32,1.909,25,3.875,1.628,16,18,5
280,Echar una mano,To lend a hand,Ayudar,Help,6.52,0.714,25,6.714285714285714,0.902,21,100.0,0.7391304347826086,23,3.5,2.226,24,10.81081081081081,19,6.5,0.673,22,4.0,1.543,22,12,3
281,Echarle cuento,Casting lies,Fingir o exagerar como excusa,Pretending or exaggerating as an excuse,5.75,1.726,24,6.2105263157894735,1.134,19,94.73684210526315,0.6086956521739131,23,2.45,1.731,20,2.272727272727273,22,2.56,1.083,25,3.1578947368421053,1.302,19,13,2
282,Echarle el guante,Put the glove on him,Atrapar a alguien que ha cometido un delito,Catching someone who has committed a crime,4.380952380952381,1.83,21,4.285714285714286,2.552,20,28.57142857142857,0.14285714285714285,21,4.714285714285714,1.978,21,11.76470588235294,17,4.4,1.429,21,3.4583333333333335,1.841,24,15,3
283,Echarle huevos,Throw eggs,Enfrentarse a algo con valentía,To confront something with bravery,6.666666666666667,0.637,24,7.0,0.0,19,100.0,0.3076923076923077,26,5.181818181818182,2.26,22,40.909090909090914,22,5.821428571428571,0.983,28,6.1,0.788,20,13,2
284,El mundo es un pañuelo,The world is a handkerchief,El mundo no es tan grande como parece,The world is not as big as it seems,6.466666666666667,0.86,30,6.571428571428571,0.676,21,100.0,0.5833333333333334,24,1.9047619047619047,1.578,21,64.70588235294117,17,5.0,1.165,29,3.9655172413793105,1.991,29,18,5
285,El papel lo aguanta todo,Paper holds everything,Se puede escribir cualquier barbaridad,You can write anything you want,1.380952380952381,0.865,21,2.05,1.701,20,0.0,0.22727272727272727,22,3.8666666666666667,1.767,15,65.21739130434783,23,4.625,1.847,8,2.923076923076923,1.847,13,20,5
286,"El que la sigue, la consigue","The one who follows, gets it",La constancia lleva al fin perseguido,Perseverance leads to the end pursued,5.72,1.458,25,6.571428571428571,1.326,21,95.23809523809523,1.0,30,4.6521739130434785,2.102,23,77.77777777777779,18,6.5,0.913,22,5.2272727272727275,1.541,22,23,6
287,El que no llora no mama,Who does not cry does not suckle,Si se quiere algo hay que suplicarlo insistentemente,If you want something you have to beg for it insistently,5.15,2.007,20,5.95,1.317,20,90.0,0.7083333333333334,24,4.695652173913044,2.032,23,78.94736842105263,19,3.8125,0.981,16,3.608695652173913,1.406,23,18,6
288,Empaparse de algo,Soak up something,Enterarse bien,To find out well,4.083333333333333,2.062,24,5.473684210526316,1.896,19,78.94736842105263,0.30434782608695654,23,5.954545454545454,1.647,22,4.3478260869565215,23,5.37037037037037,1.471,27,4.166666666666667,1.543,18,15,3
289,Empezar la casa por el tejado,Start the house from the roof,Hacer las cosas al revés,Doing things backwards,5.25,1.8,24,6.473684210526316,0.697,19,94.73684210526315,0.9,30,2.727272727272727,1.956,22,83.33333333333334,18,1.8461538461538463,0.834,26,2.6842105263157894,1.416,19,24,6
290,Empinar el codo,To bend one's elbow,Beber o emborracharse,Drinking or getting drunk,3.066666666666667,2.227,30,6.095238095238095,1.868,21,66.66666666666666,0.13043478260869565,23,4.421052631578948,2.244,19,52.94117647058824,17,3.24,2.087,25,4.391304347826087,1.751,23,13,3
291,Emplearse a fondo,Employ yourself thoroughly,Hacer algo de manera exhaustiva,Doing something thoroughly,4.761904761904762,1.947,21,6.8,0.414,15,100.0,0.875,24,3.5714285714285716,2.336,21,61.904761904761905,21,5.785714285714286,0.995,28,5.142857142857143,1.852,21,15,3
292,En boca cerrada no entran moscas,No flies can enter into a closed mouth,Es mejor callarse que equivocarse,It is better to be silent than wrong,5.566666666666666,1.736,30,5.809523809523809,1.662,21,95.23809523809523,0.375,24,6.0,1.378,21,95.0,20,3.793103448275862,1.544,29,3.1379310344827585,1.706,29,27,6
293,En menos que canta un gallo,In less time than a rooster crows,En muy poco tiempo,In a very short time,5.095238095238095,1.609,21,6.611111111111111,0.85,18,100.0,0.76,25,4.4,1.847,20,100.0,23,4.923076923076923,1.164,26,4.238095238095238,2.343,21,22,6
294,En primavera la sangre altera,In springtime the blood changes,Aumento del deseo o sensualidad,Increased desire or sensuality,5.0476190476190474,2.459,21,5.476190476190476,1.662,20,28.57142857142857,0.4,30,3.6818181818181817,2.234,22,75.0,20,4.578947368421052,1.216,20,4.875,1.849,24,25,5
295,En todas partes cuecen habas,Everywhere they boil broad beans,En todas partes hay problemas o disgustos,Everywhere there are problems or unpleasantness,2.4285714285714284,1.989,21,2.95,2.188,20,25.0,0.08,25,4.166666666666667,2.479,18,27.77777777777778,18,2.7,1.767,10,3.6,1.242,15,24,5
296,En un abrir y cerrar de ojos,In the blink of an eye,En muy poco tiempo,In a very short time,6.095238095238095,1.136,21,6.85,0.366,20,100.0,1.0,23,5.304347826086956,2.12,23,95.0,20,5.095238095238095,1.221,21,3.3181818181818183,1.287,22,22,7
297,Encogerse de hombros,Shrug your shoulders,Mostrarse indiferente ante un asunto,Being indifferent to an issue,5.333333333333333,2.078,24,6.0,1.453,19,26.31578947368421,0.6521739130434783,23,6.090909090909091,1.823,22,36.84210526315789,19,3.037037037037037,0.94,27,2.473684210526316,1.775,19,18,3
298,Encontrar la horma de su zapato,Finding the last of your shoe,Encontrar exactamente lo que se necesita,Finding exactly what is needed,2.9523809523809526,2.012,21,2.888888888888889,2.139,18,22.22222222222222,0.25,24,5.294117647058823,1.724,17,52.94117647058824,17,4.3076923076923075,1.692,26,3.7058823529411766,1.649,17,26,6
299,Encontrar una aguja en un pajar,Finding a needle in a haystack,Dificultad para encontrar algo,Difficulty in finding something,5.761904761904762,1.67,21,5.85,1.785,20,85.0,0.9166666666666666,24,4.782608695652174,1.783,23,84.21052631578947,19,4.142857142857143,1.905,21,3.909090909090909,1.63,22,26,6
300,Endeudarse hasta las cejas,Get into debt up to the eyebrows,Contraer muchas deudas,Contracting many debts,4.033333333333333,2.189,30,6.238095238095238,1.411,21,90.47619047619048,0.8928571428571429,28,1.9473684210526316,1.508,19,39.130434782608695,23,1.1379310344827587,0.581,29,3.310344827586207,2.055,29,23,4
301,Enterarse de lo que vale un peine,Finding out what a comb is worth,Advertir que alguien recibirá un castigo importante,Warn that someone will receive a major punishment,5.1,1.744,20,5.85,1.565,20,85.0,0.3333333333333333,21,4.739130434782608,1.864,23,78.94736842105263,19,2.2222222222222223,1.06,18,4.291666666666667,1.944,24,27,7
302,Entrado en años,Advanced in years,Persona de mediana edad o mayor,Middle-aged or older person,3.4166666666666665,2.083,24,6.052631578947368,1.87,19,94.73684210526315,0.7142857142857143,28,3.0526315789473686,2.248,19,0.0,20,3.3,1.081,20,2.5,1.897,16,13,3
303,Entrar a hurtadillas,Go in on the sly,Sin que nadie lo note,Without anyone noticing,4.533333333333333,1.907,30,6.619047619047619,0.921,21,100.0,0.8260869565217391,23,3.55,2.35,20,0.0,19,3.4814814814814814,1.252,27,3.7142857142857144,1.922,28,18,3
304,Entrar como elefante en cacharrería,Entering like an elephant in a pottery shop,"De forma ruda, sin sensibilidad","In a rude, insensitive way",2.7142857142857144,1.765,21,4.0476190476190474,2.729,20,57.14285714285714,0.2916666666666667,24,3.7777777777777777,2.34,18,35.0,20,2.1875,0.911,17,3.869565217391304,1.89,23,31,5
305,Entrar con buen pie,Enter on the right foot,Iniciar algo de forma prometedora,Starting something in a promising way,5.857142857142857,0.854,21,6.533333333333333,0.915,15,100.0,0.8260869565217391,23,5.142857142857143,1.769,21,78.26086956521739,23,6.107142857142857,0.956,28,5.130434782608695,1.359,23,16,4
306,Entrar con mal pie,Enter on the wrong foot,Iniciar algo de forma poco prometedora,Initiating something in an unpromising way,5.285714285714286,1.309,21,6.733333333333333,0.594,15,100.0,0.84,25,4.523809523809524,2.089,21,70.0,20,1.9285714285714286,1.215,28,3.391304347826087,1.672,23,15,4
307,Entrar en vía muerta,Enter on the dead track,Un conflicto sin solución,An unresolved conflict,1.7142857142857142,1.384,21,3.1,2.426,20,25.0,0.2727272727272727,22,2.3125,1.778,16,5.88235294117647,17,2.3636363636363638,1.567,11,2.75,1.545,12,17,4
308,Entrar por un oído y salir por otro,Enter through one ear and leave through another,No hacer caso,Ignoring,6.095238095238095,1.091,21,6.833333333333333,0.383,18,100.0,0.9166666666666666,24,3.85,2.033,20,100.0,20,2.730769230769231,1.041,26,2.619047619047619,1.687,21,28,8
309,Éramos pocos y parió la abuela,We were few and grandma gave birth,Es inoportuno el incremento de personas presentes,The increase in the number of people present is inopportune.,4.56,2.347,25,5.666666666666667,1.826,21,76.19047619047619,0.43478260869565216,23,4.3478260869565215,2.08,23,56.52173913043478,23,3.5789473684210527,1.677,19,4.428571428571429,1.63,21,25,6
310,Errar como un alma en pena,To err like a soul in pain,Deambular tristemente sin un objetivo.,Sadly wandering around without a goal.,3.0357142857142856,2.027,28,4.157894736842105,2.34,19,47.368421052631575,0.30434782608695654,23,2.388888888888889,1.975,18,65.0,20,1.7222222222222223,0.575,18,1.7727272727272727,0.752,22,21,6
311,Es de cajón,It is of drawer,Es evidente u obvio,It is evident or obvious,5.555555555555555,1.45,27,6.809523809523809,0.602,21,90.47619047619048,0.12,25,2.5,1.749,26,0.0,23,4.523809523809524,1.078,21,3.0,1.944,19,9,3
312,Es el quid de la cuestión,It is the crux of the matter,Esencia o punto más importante,Essence or most important point,5.428571428571429,1.886,21,5.666666666666667,1.853,20,80.95238095238095,0.6086956521739131,23,2.9047619047619047,2.143,21,82.6086956521739,23,4.714285714285714,0.956,22,3.6,1.871,25,20,6
313,Es peor el remedio que la enfermedad,The cure is worse than the disease,Hay ayudas peores que los problemas,There is help worse than trouble,5.791666666666667,1.532,24,5.421052631578948,2.168,19,78.94736842105263,0.8095238095238095,21,3.8636363636363638,2.315,22,60.0,20,2.259259259259259,1.13,27,2.55,1.276,20,30,7
314,Es un ángel caído,It is a fallen angel,Tuvo fama y la perdió,He had fame and lost it,3.8,2.285,20,5.4,2.037,20,20.0,0.16666666666666666,24,2.6956521739130435,1.69,23,33.33333333333333,18,4.428571428571429,1.989,14,3.227272727272727,1.688,22,14,4
315,Es un arma de doble filo,It's a double-edged sword,Una acción puede tener efectos contrarios a los esperados,An action can have effects contrary to those expected,4.761904761904762,1.972,21,5.866666666666666,1.598,15,46.666666666666664,0.6153846153846154,26,4.388888888888889,2.304,18,80.0,20,3.125,1.329,24,4.894736842105263,1.41,19,19,6
316,Es un asunto de faldas,It's a skirt issue,Aventura amorosa,Love affair,2.4285714285714284,1.989,28,2.6315789473684212,2.241,19,36.84210526315789,0.32,25,3.5,2.422,16,0.0,20,3.272727272727273,0.647,11,2.857142857142857,1.791,14,18,5
317,Es un callejón sin salida,It's a dead end,Un conflicto sin solución,A conflict without solution,5.935483870967742,1.548,31,6.476190476190476,0.512,21,95.23809523809523,0.7692307692307693,26,5.954545454545454,1.588,22,100.0,20,1.6666666666666667,0.966,21,3.0454545454545454,1.759,22,21,5
318,Es un círculo vicioso,It's a vicious circle,Situación repetitiva que no sabemos como modificar,A repetitive situation that we do not know how to change,5.96,1.241,25,6.476190476190476,1.123,21,100.0,0.7391304347826086,23,4.0,2.0,24,55.00000000000001,20,2.5454545454545454,1.143,22,4.363636363636363,1.364,22,18,4
319,Es un comodín,It's a wild card,Algo que sirve para todo,Something that serves for everything,3.52,1.735,25,4.619047619047619,2.179,21,76.19047619047619,0.88,25,4.636363636363637,1.866,22,0.0,19,4.611111111111111,1.378,18,3.25,1.41,20,11,3
320,Es un grano en el culo,It's a zit in the ass,Algo que molesta mucho,Something that bothers a lot,5.5,1.795,28,6.631578947368421,0.831,19,100.0,0.8181818181818182,22,4.105263157894737,2.378,19,90.0,20,1.368421052631579,0.496,19,3.230769230769231,2.084,26,17,6
321,Es un nido de ratas,It's a rat's nest,Sitio sucio ,Dirty place ,2.8095238095238093,1.834,21,3.7,2.105,20,30.0,0.8,30,3.6,2.371,20,5.88235294117647,17,1.5,0.73,16,4.294117647058823,2.054,17,15,5
322,Es un punto y aparte,It's a period,"Alguien peculiar, distinto a los otros","Someone peculiar, different from the others",4.481481481481482,1.762,27,5.285714285714286,1.875,21,61.904761904761905,0.3333333333333333,24,5.666666666666667,1.881,27,57.14285714285714,21,3.4285714285714284,1.207,21,2.6842105263157894,1.529,19,16,5
323,Es un rayo de sol,It's a ray of sunshine,Un poco de esperanza,A bit of hope,2.7857142857142856,1.813,28,4.315789473684211,2.11,19,10.526315789473683,0.4230769230769231,26,4.611111111111111,2.146,18,41.17647058823529,17,6.176470588235294,0.728,17,4.333333333333333,2.014,24,13,5
324,Es un zorro,It's a fox,Persona muy astuta,Very clever person,4.0,1.762,30,5.809523809523809,1.75,21,85.71428571428571,0.38461538461538464,26,4.842105263157895,2.5,19,0.0,19,3.4482758620689653,1.993,29,3.586206896551724,1.937,29,9,3
325,Es una muerte anunciada,It's a death foretold,Sucede algo negativo que se esperaba,Something negative happens that was expected,3.033333333333333,2.173,30,5.476190476190476,2.136,21,80.95238095238095,0.8181818181818182,22,4.380952380952381,2.291,21,0.0,17,1.7037037037037037,0.823,27,2.88,1.833,25,20,4
326,Es una sombra de lo que fue,It is a shadow of its former self,Haber degenerado o decaído mucho,To have degenerated or declined a lot,2.7142857142857144,1.707,21,4.761904761904762,2.364,20,71.42857142857143,0.8260869565217391,23,1.85,1.089,20,13.043478260869565,23,2.1176470588235294,0.993,18,2.8333333333333335,1.606,24,21,7
327,Es una víbora,It is a viper,Mala persona,Bad person,4.25,1.97,20,5.9,1.917,20,95.0,0.38095238095238093,21,4.913043478260869,1.782,23,0.0,19,1.1111111111111112,0.323,18,5.08,2.1,25,11,3
328,Esconder la cabeza bajo el ala,To hide the head under the wing,Mostrar cobardía,Showing cowardice,2.1904761904761907,1.47,21,4.05,2.212,20,30.0,0.72,25,3.0869565217391304,2.109,23,19.047619047619047,21,2.0,1.029,18,2.65,1.137,20,25,6
329,Escuchar al corazón,Listen to the heart,Guiarse por los sentimientos,Guided by feelings,6.166666666666667,1.049,24,6.7368421052631575,0.653,19,89.47368421052632,0.76,25,5.590909090909091,1.817,22,13.043478260869565,23,5.607142857142857,1.197,28,4.4,1.569,20,17,3
330,Escuchar llover,Listen to the rain,Mostrar poco interés,Showing little interest,3.0714285714285716,2.054,28,3.473684210526316,2.22,19,36.84210526315789,0.08695652173913043,23,5.9411764705882355,1.784,17,11.11111111111111,18,3.933333333333333,1.751,15,2.4285714285714284,1.165,21,14,2
331,Escupir al cielo,Spit at the sky,Decir algo que se vuelve en contra,Saying something that backfires,2.0,1.376,20,3.3,2.386,20,40.0,0.2916666666666667,24,4.869565217391305,2.074,23,22.22222222222222,18,2.0,0.679,14,3.5714285714285716,1.502,21,14,3
332,Escurrir el bulto,Hide the package,Eludir un trabajo o compromiso,Avoiding a job or commitment,4.483870967741935,2.158,31,5.0476190476190474,2.334,21,80.95238095238095,0.08695652173913043,23,3.5,1.739,22,52.17391304347826,23,2.6470588235294117,1.115,17,2.8095238095238093,1.25,21,15,3
333,Esperar sentado a que pase algo,Sitting and waiting for something to happen,Esperar algo que nunca sucederá,Expecting something that will never happen,4.7,2.003,20,6.5,0.827,20,90.0,0.8260869565217391,23,6.608695652173913,0.722,23,10.0,20,2.611111111111111,0.916,18,1.68,0.988,25,26,6
334,Está lo mejor de cada casa,There's the best of every house,Se agrupan los más destacados en algo,Grouping the most prominent in something,4.444444444444445,1.739,27,4.095238095238095,2.427,21,57.14285714285714,0.6956521739130435,23,4.958333333333333,2.095,24,36.84210526315789,19,5.45,1.761,20,3.6,1.875,20,21,6
335,Está que trina,He/she is trilling,Estar muy enfadado,Being very angry,4.857142857142857,2.032,21,5.476190476190476,2.294,20,76.19047619047619,0.3333333333333333,24,1.9047619047619047,1.338,21,31.57894736842105,19,1.8571428571428572,1.108,22,4.56,1.417,25,12,3
336,Está todo el pescado vendido,All the fish is sold,Todo está ya claro,Everything is already clear,3.9523809523809526,2.179,21,4.75,2.511,20,70.0,0.22727272727272727,22,4.6521739130434785,2.269,23,50.0,18,3.6842105263157894,1.108,19,3.736842105263158,1.851,19,24,5
337,Estar a dos velas,To be at two candles,Situación económica apurada,Financial situation in a hurry,5.96,1.338,25,6.380952380952381,1.359,21,80.95238095238095,0.17391304347826086,23,2.0,1.234,22,57.89473684210527,19,1.9545454545454546,1.046,22,2.272727272727273,1.386,22,14,4
338,Estar a la que salta,To be about to jump,Muy atento a la oportunidad (o para criticar),Very attentive to the opportunity (or to criticize),3.892857142857143,2.283,28,4.631578947368421,2.362,19,84.21052631578947,0.125,24,3.4444444444444446,2.307,18,52.17391304347826,23,2.625,1.455,16,4.625,1.929,24,16,5
339,Estar a la sombra,To be in the shade,Ser inferior a alguien,Being inferior to someone,3.9166666666666665,1.863,24,5.2631578947368425,1.593,19,31.57894736842105,0.5909090909090909,22,6.095238095238095,1.609,21,0.0,23,2.36,1.381,25,1.894736842105263,0.875,19,14,4
340,Estar a las duras y a las maduras,To be in the hard and the mature,Estar con alguien tanto si las cosas van bien como si van mal,Being with someone whether things are going good or bad,4.7272727272727275,2.142,22,6.0,1.976,22,90.9090909090909,0.6086956521739131,23,3.388888888888889,1.754,18,76.19047619047619,21,6.304347826086956,0.926,23,5.384615384615385,1.577,26,26,8
341,Estar a por uvas,To be in for grapes,"Despistado, ausente","Absent-minded, absent",2.1363636363636362,1.935,22,2.8181818181818183,2.666,22,27.27272727272727,0.03333333333333333,30,3.0833333333333335,2.021,12,25.0,20,2.857142857142857,0.378,7,3.111111111111111,1.054,9,13,4
342,Estar a punto de caramelo,To be on the verge of caramel,Estar casi listo,To be almost ready,4.36,1.934,25,5.761904761904762,1.7,21,66.66666666666666,0.21739130434782608,23,2.3333333333333335,1.653,21,13.043478260869565,23,5.9523809523809526,0.865,21,5.523809523809524,1.078,21,21,5
343,Estar al loro,To be on the parrot,Estar atento,To be attentive,5.380952380952381,1.431,21,6.866666666666666,0.352,15,100.0,0.17857142857142858,28,2.3,1.895,20,0.0,17,5.071428571428571,1.016,28,4.9523809523809526,1.431,21,11,3
344,Estar al pie del cañón,To be at the foot of the canyon,Dispuesto a hacer lo que sea necesario,Willing to do whatever it takes,4.96,1.947,25,6.095238095238095,1.609,21,66.66666666666666,0.23333333333333334,30,3.8636363636363638,2.077,22,85.0,20,4.681818181818182,1.985,22,5.545454545454546,1.143,22,18,5
345,Estar chupado,To be sucked,Ser muy fácil,Being very easy,5.741935483870968,1.825,31,6.476190476190476,0.928,21,100.0,0.21739130434782608,23,4.454545454545454,2.22,22,0.0,17,5.15,2.455,20,3.9047619047619047,2.343,21,12,2
346,Estar ciego,To be blind,No ser capaz de ver algo evidente,Not being able to see something obvious,6.125,1.541,24,6.368421052631579,0.955,19,94.73684210526315,0.9130434782608695,23,6.590909090909091,1.141,22,0.30959752321981426,17,2.0714285714285716,1.016,28,2.5,1.821,20,10,2
347,Estar colado por alguien,To be smitten with someone,Estar enamorado de alguien,Being in love with someone,6.0476190476190474,1.396,21,6.904761904761905,0.301,20,95.0,0.4,25,2.227272727272727,1.744,22,57.89473684210527,19,5.333333333333333,0.966,22,4.72,1.792,25,21,4
348,Estar como el palo de un gallinero,To be like the stick of a henhouse,Estar sucio,Being dirty,2.0476190476190474,1.802,21,2.888888888888889,2.139,18,16.666666666666664,0.3181818181818182,22,2.2857142857142856,1.204,14,4.3478260869565215,23,2.4761904761904763,1.289,21,3.8823529411764706,1.764,17,28,7
349,Estar como sardinas en lata,To be like sardines in a can,Estar muy apretados,Being too tight,4.25,1.97,20,6.85,0.489,20,100.0,0.8571428571428571,28,4.043478260869565,1.846,23,95.0,20,1.8235294117647058,0.809,17,3.64,1.753,25,23,5
350,Estar como un fideo,To be like a noodle,Estar muy flaco,Being too skinny,5.181818181818182,2.062,22,6.818181818181818,0.501,22,100.0,0.9545454545454546,22,3.5555555555555554,2.036,18,2.7027027027027026,19,3.12,1.013,25,2.4074074074074074,1.6,27,16,4
351,Estar como un flan,To be like a flan,Estar muy nervioso,Being very nervous,4.809523809523809,1.75,21,6.8,0.561,15,60.0,0.48,25,2.7,1.976,20,1.3513513513513513,19,4.038461538461538,1.822,26,4.454545454545454,1.845,22,15,4
352,Estar como un roble,To be like an oak tree,Muy fuerte físicamente,To be physically very strong,4.05,1.877,20,6.9,0.308,20,100.0,0.8260869565217391,23,3.347826086956522,2.036,23,0.0,19,6.111111111111111,0.758,18,3.96,1.767,25,16,4
353,Estar como un tren,To be like a train,Ser muy atractivo/a,Being very attractive,5.380952380952381,1.499,21,6.476190476190476,1.436,20,90.47619047619048,0.16,25,1.9545454545454546,1.731,22,14.864864864864865,19,6.666666666666667,0.483,22,6.08,1.352,25,15,4
354,Estar como una cabra,To be like a goat,Comportarse sin cordura,Behaving without sanity,6.48,1.229,25,6.428571428571429,1.363,21,95.23809523809523,0.5217391304347826,23,2.2083333333333335,1.318,24,66.66666666666666,19,4.7727272727272725,1.307,22,4.545454545454546,1.335,22,17,4
355,Estar como una foca,To be like a seal,Estar muy gordo,Being very fat,6.032258064516129,1.56,31,6.809523809523809,0.402,21,100.0,0.9583333333333334,24,4.545454545454546,1.969,22,0.0,19,1.7142857142857142,0.956,21,3.3181818181818183,1.961,22,16,4
356,Estar como una regadera,To be like a watering can,Comportarse sin cordura,Behaving without sanity,5.954545454545454,1.133,22,6.363636363636363,1.465,22,95.45454545454545,0.25,24,1.9444444444444444,1.514,18,19.696969696969695,19,3.12,1.59,25,4.962962962962963,1.72,27,20,4
357,Estar como una rosa,To be like a rose,Con buena salud y aspecto,In good health and appearance,5.375,1.715,24,6.526315789473684,0.841,19,100.0,0.7727272727272727,22,3.1363636363636362,2.21,22,0.7575757575757576,19,6.62962962962963,0.688,27,5.2631578947368425,1.522,19,16,4
358,Estar como una sopa,To be like a soup,Estar muy mojado (ej. Por la lluvia),Being very wet (e.g. from rain),3.64,2.158,25,3.9523809523809526,2.312,21,19.047619047619047,0.34782608695652173,23,1.85,0.988,20,0.0,19,2.2222222222222223,1.114,18,2.4,1.465,20,16,4
359,Estar como una tapia,To be like a wall,Estar sordo,Being deaf,4.818181818181818,2.108,22,6.136363636363637,1.833,22,59.09090909090909,0.4782608695652174,23,2.176470588235294,1.845,17,0.0,19,2.7916666666666665,1.215,24,3.8846153846153846,1.946,26,17,4
360,Estar como una vaca,To be like a cow,Estar gordo,To be fat,5.4,1.905,30,6.333333333333333,1.798,21,90.47619047619048,0.9642857142857143,28,3.619047619047619,2.376,21,0.0,19,1.7777777777777777,1.311,27,3.357142857142857,2.215,28,16,4
361,Estar como unas castañuelas,To be like a castanet,Muy alegre,Very cheerful,3.8518518518518516,1.725,27,5.428571428571429,1.69,21,38.095238095238095,0.36666666666666664,30,2.28,1.242,25,17.073170731707318,21,4.944444444444445,1.798,18,4.764705882352941,1.751,17,24,4
362,Estar como unas Pascuas,To be like Easter,Estar alegre,To be cheerful,2.966666666666667,2.125,30,3.4285714285714284,2.399,21,52.38095238095239,0.3,30,2.125,1.996,16,0.0,21,4.75,2.173,20,4.238095238095238,1.841,21,20,4
363,Estar con el agua al cuello,To be with the water up to the neck,Estar en apuros,To be in trouble,5.380952380952381,1.658,21,6.3,0.979,20,100.0,0.8636363636363636,22,4.043478260869565,2.011,23,75.0,20,1.3333333333333333,0.577,21,4.954545454545454,2.011,22,22,6
364,Estar con un pie a cada lado de la calle,To be with one foot on either side of the street,Involucrado en dos cosas opuestas,Involved in two opposite things,2.2580645161290325,1.57,31,2.380952380952381,1.596,21,42.857142857142854,0.2,30,4.052631578947368,1.649,19,0.0,19,2.764705882352941,1.3,17,2.1875,1.759,16,31,10
